{
  "shipId": "s-4",
  "version": 2,
  "shipType": {
    "bt": "st-cutlass",
    "name": "Cutlass Black"
  },
  "name": "Black Betty",
  "insurance": {
    "kind": "LTI"
  },
  "fitted": true,
  "orgUnit": {
    "id": "0d6f3c1a-5b2e-4f7a-9c8d-1e2f3a4b5c6d",
    "name": "Staffel Nord",
    "shorthand": "NORD",
    "kind": "SQUADRON"
  },
  "orgUnitVersion": 1
}
